{
  "body": "Session 2026-08-29 (second): plan \u00a710 items 2\u20135 closed, plus the deploy that made item 3 real.\n\n## What is done and verified\n\n1. **Telemetry capture fixed, and the cause was not the one in the note.** It is not\n   that `command -v auditctl` *fails* in a non-login hook shell \u2014 it *succeeds on the\n   wrong binary*. `/usr/bin/auditctl` is the Linux kernel audit tool (`audit` package,\n   installed 2026-07-31); it answers \"You must be root\", exits 0, and the publisher call\n   ends in `|| true`, so the record vanished. subagent-exit.sh's `~/.local/bin` fallback\n   was inert for the same reason: it sat *behind* `command -v`. One shared resolver now,\n   `hooks/auditctl-resolve.sh`, with `tests/test-auditctl-resolve.sh` as its gate.\n\n2. **Resumability is proven, as an outcome.** `resume-and-settle` (agentops\n   `templates/dispatch/acceptance/`) was written to fail, ran black-box against\n   vuoro-shared, and failed \u2014 on something other than the missing `session resume`\n   aggregate. The components serve it in six commands, exactly as plan rev. 2 said. It\n   failed because a session's position did not survive the process that held it:\n   `record_handoff_generated` stored only *that* a handoff happened and dropped the\n   `git_context` the client had computed, sent, and had echoed back.\n\n   Running the outcome also found a defect nobody was looking for: `work.read.handoff`\n   crashed for any sprint holding an active reservation \u2014 the exact state an interrupted\n   session leaves behind, and the surface a resumer is told to read first. A pg\n   `datetime` compared with a sqlite-shaped `str` in the one expression only the handoff\n   bundle evaluates.\n\n   Both fixed, released and deployed: sprintctl 0.3.4 \u2192 vuoro-service 0.1.55 (image\n   `sha256:92508004\u2026`) \u2192 appservice `cd32a254`. Scenario now PASS 1.000, all nine gates,\n   recorded in `_artifacts/agentops/acceptance/resume-and-settle/`.\n\n3. **Scorer revisions pinned** (acceptance-lab PR #4, merged). Per-scorer revision on\n   every score, per-run revisions plus a harness revision, a behavioural-digest lock that\n   fails the suite if a scorer changes without a bump, and `compare` refusing runs whose\n   revisions differ. The `resume-and-settle` evidence was re-scored under the pinned\n   build so the PASS is citable.\n\n4. **The bindery dispatch cycle is extracted** as `dispatch-cycle` (scenario + probe +\n   `docs/assessments/dispatch-cycle-substrate-vs-consumer-2026-08-29.md`), and the\n   driver now publishes the cycle's arms itself.\n\n## Do not re-derive these\n\n- The dispatch arm vocabulary (`dispatch.packet.rejected` / `.reviewed` / `.accepted`,\n  `dispatch.preflight_rejected`) was **never a mechanism**. It is not a validated\n  auditctl type and nothing emitted it; all 23 events were typed by hand by\n  luna-coordinator, in bindery-core, on 2026-08-24. That is why 16 of bindery's own 18\n  cycles are incomplete and why 2 complete cycles exist across 15 repositories with\n  audit streams. `hybrid_dispatch.py` now emits the refused and reviewed arms, and\n  `--accepted <commit>` closes the third. The past is deliberately **not** retrofitted.\n- `homelab-analytics` has **zero** dispatch cycles. The non-agent-infrastructure\n  consumer proof \u00a710.5 asks for cannot be extracted from the record; it has to be run.\n- `ast.dump` is not stable across Python versions \u2014 every scorer digest differed between\n  3.12 and 3.14 and CI caught it. The lock digests `ast.unparse` output instead.\n- `auditctl` writes to `<AUDITCTL_ARTIFACTS_ROOT>/_artifacts/<scope>/<kind>`. A probe\n  pointed at the root rather than at `<root>/_artifacts` finds nothing and says so\n  confusingly.\n- Pinning the scorers alone would have left the same hole in a smaller place: flipping\n  `>=` to `>` in `score_candidate` rewrote every verdict in the store with the scorer\n  lock still green. `score_candidate` and `evaluate_candidate` are locked too.\n- The v4 composition profile had been attesting a work operation-hash **no shipped\n  adapter produced**, since the 0.3.3 repin on 08-28: the migration script copied the\n  digest from a validator instead of reading it. Fixed by deriving it (vuoro `13f65a3`).\n\n## In flight, outcome unknown to me\n\nA dispatched session is working in `/projects/dev/homelab-analytics` on the enabler work\nand an appservice deployment. It has opened homelab-analytics PR #16\n(\"ci(images): publish api/web container images and pin them by\u2026\"). **I have not seen its\nresult.** Its brief: publish the two container images the chart references and which do\nnot exist (`ghcr.io/bayleafwalker/homelab-analytics{,-web}:0.1.0`), add the missing\npublish workflow (only `pages.yml` and `verify.yaml` exist), then deploy per the repo's\nown `docs/notes/appservice-cluster-integration-notes.md` \u2014 namespace `analytics`, route\n`analytics.${DOMAIN_0}`, first rollout shape only. Read its report or PR #16 before\nassuming anything about state there.\n\n## Flags for whoever picks this up\n\n- **vuoro `main` is one merge ahead of the deployed image.** PR #64 (E-8 principal\n  subject, not this session's work) merged after the 0.1.55 release commit, so that\n  change is *not* in the running service. The local checkout is left on branch\n  `e8-principal-subject`.\n- **appservice has 8 dirty files that are not mine** \u2014 five `pvc.yaml` plus two untracked\n  `docs/` files (truenas encryption/cutover work). Do not `git add -A` there.\n- Reservation 33 (item 2254, session \"interactive\", stale since 08-26) predates all of\n  this and was deliberately left alone.\n- `sprintctl` `tests/test_release_contract.py` fails locally whenever `dist/` holds more\n  than one wheel. It asserts exactly one. Delete the stale wheel; it is not a regression.\n- acceptance-lab's `CONDITIONAL` carries no machine-readable conditions, owner or\n  expiry, which plan \u00a72 says it must to be a verdict. `dispatch-cycle` returns\n  CONDITIONAL for ERM-005 today, so this is now load-bearing rather than theoretical.\n\n## What is next\n\nPlan \u00a710 item 6 \u2014 run the loop once, manually \u2014 is the only first move left, and it\nwants the owner in it: its value is the *measured* operator interventions, which a\nsimulated run does not produce. The arms now record themselves, so a loop run after\ntoday measures itself rather than depending on anyone remembering to write prose.",
  "capsule_ref": null,
  "created_at": "2026-08-29T09:06:16Z",
  "note_id": "afe81167-e7f3-4054-a6b4-8237bacc8579",
  "note_kind": "handover",
  "origin_stream_id": "2b874ce2-e1ba-4c2f-911b-1488f922cf51",
  "privacy": {
    "raw_transcript_captured": false,
    "raw_transcript_ref": null,
    "retention_days": null
  },
  "repo": {
    "project": "agentops"
  },
  "runtime_session_id": null,
  "schema_version": "session-note/v1",
  "supersedes": "0e0fcdcd-bb70-4916-bf80-46ebb780093a",
  "target_refs": [
    "wi:2311"
  ]
}
