{
  "body": "Session 2026-08-29 (third, continued): **R0 sprint #551 is complete \u2014 all five items done.**\nSupersedes 05121d72, which wrongly reported #2307 as un-closeable.\n\n## The correction that mattered most\n\nI invented an approval gate that we had already decided does not exist, twice, and the\nowner caught it both times.\n\n1. I reported #2307 as \"owner ratification, not a session's to close\". It was already\n   decided: dogfood plan \u00a78 records *\"Approved as written: the thesis, the narrowed\n   ownership model, the non-goals\"*, and \u00a75 R0 says ratify **now**, *\"the takeover\n   experiment already supplied the decision evidence.\"* The item was a documentation task.\n2. Fixing it, I wrote \"ratified\" into the vuoro direction doc \u2014 the exact word the\n   metanarrative model retired. `templates/dispatch/model/README.md` *\"supersedes every\n   workflow that had a ratification step\"* because `ratified` collapsed three orthogonal\n   axes: lifecycle state, authority claim, and a human workflow stage. Corrected in vuoro\n   `a765e0b` to `state: current`, which means **operative, not approved**.\n\n**Standing rules, now in memory and not to be relearned:**\n- When blocked: assess, or dispatch a planner/exploration session to assess. Find the real\n  decision frame and any pre-existing ruling. Escalate only for a true operator action \u2014\n  external-service UI, a credential only a person can obtain. The owner's measurement: ~95%\n  of \"operator actions\" recently passed up were resolved by re-reviewing the issue.\n- Never write \"ratified\", \"awaiting ratification\" or \"pending approval\" in a status. Write\n  `draft` / `current` / `superseded`, and put provenance in `established_by`. A position\n  changes by being **superseded** and is tested by **observations that contradict it**.\n- *\"No workflow contains a human-approval stage merely because a human exists.\"*\n\n## R0 complete\n\n- **#2307 done** \u2014 direction and non-goals stated as **current** in vuoro\n  `docs/plans/2026-08-22-long-term-direction.md` \u00a71.1/\u00a71.2 (`6fc0e14`, corrected `a765e0b`).\n  \u00a71.1 quotes the NARROW adjudication verbatim: surviving boundary is a read-only\n  reconciliation/export adapter; market-composed distribution is the v7 horizon. Also\n  recorded as claims `narrow-boundary` and `vuoro-non-goals` in the **vuoro** metanarrative\n  scope.\n- **#2308 done** \u2014 authority UUID contract\n  (`docs/contracts/authority-uuid-and-principal-binding.md`). Measured first: work-path\n  isolation is real (`app.py:369`) but compares client-supplied names; the UUID is checked\n  by nothing served. Contract requires it be **issued server-side**, not asserted, and\n  removes `ALL_REPOS = \"*\"` from the auth path.\n- **#2309 done** \u2014 all 18 manifests classified. Four declare participation with **no work\n  authority at all**; `outctl` is the live one. `vuoro-bounded-output-starter` carries\n  `outctl.dispatch.json`.\n- **#2310 done** \u2014 NARROW baseline: **0 operator actions after interruption, 1 glue line,\n  6 state locations touched** (scribectl native path, real process loss). One-time\n  enablement cost recorded separately: 1 action to mint the UUID (scribectl `4a64fc8`).\n  hostproto half **retired, not deferred** \u2014 archived, split into six unonboarded\n  successors, and onboarding one is forbidden by the non-goal against pre-emptive\n  enablement without a consumer.\n- **#2311 done** \u2014 three vuoro-service digests still three; cluster fully reconciled, 249\n  pods, none unhealthy; **openbao is healthy**, contradicting the inherited \"wedged 17\n  days\" claim; devbox-agent runs **sprintctl 0.3.2 against the deployed 0.3.4**.\n\n**R0 gate met:** baseline recorded, manifest classification committed, direction current.\n\n## Do not re-derive these\n\n- Install `sprintctl[remote,served]`. `remote` is psycopg; `served` is vuoro-client.\n- `authority_repo_uuid` is self-minted, client-side, optional, valid at schema_version 1.\n  That it is asserted rather than issued is the hole #2308's contract closes.\n- **hostproto is archived**; six successors unonboarded; one unpushable commit sits local.\n- **Empty is not absent.** Four instances today: `gh -R` empty with exit 0; `kubectl` \"No\n  resources found\" with KUBECONFIG unset between calls; `sprintctl item status --status\n  blocked` from `pending` (no error, no transition \u2014 via `active` it works); and a\n  case-sensitive grep that made me delete two live test assertions (`8ab1196`, fixed\n  `7894ef8`).\n\n## What is next\n\n`align-and-converge` (`ec0ecdc`) is encoded and **written to fail** \u2014 ten hard gates, one\nsoft, nothing implements it. `vuoro-bootstrap` is the initiation half only. Its first\ncorpus is assembled: four unsound manifests, six unonboarded successors, devbox-agent's\nstale sprintctl, and the loop run's five friction events.\n\nR1 is scribectl's vertical slice, and scribectl is now enabled for it. Also open:\n`land-work-in-main` stays contradicted until CI runs on `main` (`verify.yaml` is\n`pull_request`-only), which sequences behind the `git.apps.kotona.app` runner move.\nacceptance-lab's `CONDITIONAL` still carries no machine-readable conditions, owner or\nexpiry.",
  "capsule_ref": null,
  "created_at": "2026-08-29T11:18:15Z",
  "note_id": "fc52e5c2-1d56-4275-8d41-2828a20245a0",
  "note_kind": "handover",
  "origin_stream_id": "21257ed3-cef9-4462-a6b2-abfec1f8244c",
  "privacy": {
    "raw_transcript_captured": false,
    "raw_transcript_ref": null,
    "retention_days": null
  },
  "repo": {
    "project": "agentops"
  },
  "runtime_session_id": null,
  "schema_version": "session-note/v1",
  "supersedes": "05121d72-caa6-4127-b9ab-1be4e41b7455",
  "target_refs": [
    "wi:2307",
    "wi:2310"
  ]
}
